{
  "$schema": "http://json-schema.org/draft-07/schema#",
  "$id": "https://chordviewer.app/schemas/lead-sheet-v1.schema.json",
  "title": "ChordViewer lead sheet version 1",
  "description": "M2 proof: one treble melody voice, C key signature and 4/4 at 480 ticks per quarter. Additional musical invariants are enforced by parseScore.",
  "type": "object",
  "additionalProperties": false,
  "required": [
    "schemaVersion",
    "id",
    "title",
    "keySignature",
    "timeSignature",
    "ticksPerQuarter",
    "measures"
  ],
  "properties": {
    "schemaVersion": {
      "type": "integer",
      "const": 1
    },
    "id": {
      "$ref": "#/definitions/id"
    },
    "title": {
      "type": "string",
      "minLength": 1,
      "maxLength": 200,
      "$ref": "#/definitions/text"
    },
    "keySignature": {
      "type": "string",
      "const": "C"
    },
    "timeSignature": {
      "type": "object",
      "additionalProperties": false,
      "required": [
        "numerator",
        "denominator"
      ],
      "properties": {
        "numerator": {
          "type": "integer",
          "const": 4
        },
        "denominator": {
          "type": "integer",
          "const": 4
        }
      }
    },
    "ticksPerQuarter": {
      "type": "integer",
      "const": 480
    },
    "measures": {
      "type": "array",
      "minItems": 1,
      "maxItems": 256,
      "items": {
        "$ref": "#/definitions/measure"
      }
    }
  },
  "definitions": {
    "text": {
      "type": "string",
      "pattern": "^(?:[^\\u0000\\uD800-\\uDFFF]|[\\uD800-\\uDBFF][\\uDC00-\\uDFFF])*(?![\\s\\S])"
    },
    "id": {
      "type": "string",
      "minLength": 1,
      "maxLength": 64,
      "pattern": "^[A-Za-z0-9_-]+(?![\\s\\S])"
    },
    "offset": {
      "type": "integer",
      "minimum": 0,
      "maximum": 1919
    },
    "duration": {
      "type": "object",
      "additionalProperties": false,
      "required": [
        "denominator",
        "dots"
      ],
      "properties": {
        "denominator": {
          "type": "integer",
          "enum": [
            1,
            2,
            4,
            8,
            16,
            32
          ]
        },
        "dots": {
          "type": "integer",
          "enum": [
            0,
            1
          ]
        }
      },
      "allOf": [
        {
          "if": {
            "properties": {
              "denominator": {
                "const": 32
              }
            }
          },
          "then": {
            "properties": {
              "dots": {
                "const": 0
              }
            }
          }
        }
      ]
    },
    "pitch": {
      "type": "object",
      "additionalProperties": false,
      "required": [
        "step",
        "alter",
        "octave"
      ],
      "properties": {
        "step": {
          "type": "string",
          "enum": [
            "C",
            "D",
            "E",
            "F",
            "G",
            "A",
            "B"
          ]
        },
        "alter": {
          "type": "integer",
          "enum": [
            -1,
            0,
            1
          ]
        },
        "octave": {
          "type": "integer",
          "minimum": 3,
          "maximum": 6
        }
      }
    },
    "chord": {
      "type": "object",
      "additionalProperties": false,
      "required": [
        "id",
        "offsetTicks",
        "durationTicks",
        "symbol"
      ],
      "properties": {
        "id": {
          "$ref": "#/definitions/id"
        },
        "offsetTicks": {
          "$ref": "#/definitions/offset"
        },
        "durationTicks": {
          "type": "integer",
          "minimum": 1,
          "maximum": 1920
        },
        "symbol": {
          "type": "string",
          "minLength": 1,
          "maxLength": 32,
          "$ref": "#/definitions/text"
        }
      }
    },
    "note": {
      "type": "object",
      "additionalProperties": false,
      "required": [
        "id",
        "kind",
        "offsetTicks",
        "duration",
        "pitch"
      ],
      "properties": {
        "id": {
          "$ref": "#/definitions/id"
        },
        "kind": {
          "type": "string",
          "const": "note"
        },
        "offsetTicks": {
          "$ref": "#/definitions/offset"
        },
        "duration": {
          "$ref": "#/definitions/duration"
        },
        "pitch": {
          "$ref": "#/definitions/pitch"
        },
        "tieToNext": {
          "type": "boolean"
        }
      }
    },
    "rest": {
      "type": "object",
      "additionalProperties": false,
      "required": [
        "id",
        "kind",
        "offsetTicks",
        "duration"
      ],
      "properties": {
        "id": {
          "$ref": "#/definitions/id"
        },
        "kind": {
          "type": "string",
          "const": "rest"
        },
        "offsetTicks": {
          "$ref": "#/definitions/offset"
        },
        "duration": {
          "$ref": "#/definitions/duration"
        }
      }
    },
    "measure": {
      "type": "object",
      "additionalProperties": false,
      "required": [
        "id",
        "chords",
        "melody"
      ],
      "properties": {
        "id": {
          "$ref": "#/definitions/id"
        },
        "chords": {
          "type": "array",
          "maxItems": 64,
          "items": {
            "$ref": "#/definitions/chord"
          }
        },
        "melody": {
          "type": "array",
          "maxItems": 64,
          "items": {
            "oneOf": [
              {
                "$ref": "#/definitions/note"
              },
              {
                "$ref": "#/definitions/rest"
              }
            ]
          }
        }
      }
    }
  }
}
